{
  "id": "EVAL-SPLICE-001",
  "title": "Buyer creates a Capital PO \u2014 data-triggered splice from po_type",
  "covers_journeys": [
    "PoCrt"
  ],
  "covers_modules": [
    "PO"
  ],
  "category": "single-journey-with-splice",
  "difficulty": "medium",
  "user_persona": "Capital projects buyer ordering a fixed asset",
  "conversation": [
    {
      "turn": 1,
      "user": "I need to create a Capital PO for a new milling machine from supplier SUP-CAP-1."
    },
    {
      "turn": 2,
      "user": "Proposal is CAP-PROP-2026-04."
    },
    {
      "turn": 3,
      "user": "Numbering series PO/CAP/2026, today, USD, buyer BUY-77. One line: ITM-MILL-X, 1 unit at 75000."
    },
    {
      "turn": 4,
      "user": "Create it for approval."
    }
  ],
  "ground_truth": {
    "kind": "commit",
    "no_writes_expected": false,
    "status_after": "Draft",
    "writes": [
      {
        "task": "POCRTMAINSBT",
        "activity": "POCRT",
        "screen": "PoCrtMain",
        "via_sp_chain": [
          "pocrmn_sp_crt_hdrsav",
          "pocrmn_sp_crt_hdrchk",
          "pocrmn_sp_crtgrd",
          "pocrmn_sp_init_suptxreg",
          "pocrmn_sp_aprhref",
          "pocrmn_sp_crtgrd_out"
        ],
        "tables_required": [
          "po_paytm_linelevel_detail",
          "po_poitm_item_detail",
          "po_pomas_pur_order_hdr",
          "po_poshd_schedule_dtl",
          "po_powh_allocation_dtl"
        ],
        "slot_values_required": {
          "po_type": "Capital",
          "supplier_code": "SUP-CAP-1",
          "capital_proposal_id": "CAP-PROP-2026-04",
          "numbering_series": "PO/CAP/2026",
          "po_date": "<today>",
          "currency": "USD",
          "buyer": "BUY-77",
          "item_code": "ITM-MILL-X",
          "quantity": 1,
          "cost": 75000
        },
        "status_after": "Draft"
      }
    ]
  }
}