{
  "id": "EVAL-DISC-004",
  "title": "First-time user requests guided onboarding for their first PO",
  "covers_journeys": [
    "PoCrt"
  ],
  "covers_modules": [
    "PO"
  ],
  "category": "discovery",
  "difficulty": "medium",
  "user_persona": "A buyer who is anxious about doing it wrong and wants step-by-step hand-holding",
  "conversation": [
    {
      "turn": 1,
      "user": "I'm new here. I need to make my first purchase order but I have no idea where to start. Can you walk me through it?"
    },
    {
      "turn": 2,
      "user": "Nothing, just from scratch."
    },
    {
      "turn": 3,
      "user": "I don't know what numbering series is. Can you explain?"
    },
    {
      "turn": 4,
      "user": "Just use the default, let's move on. Supplier is SUP-100, date is today, currency USD."
    },
    {
      "turn": 5,
      "user": "5 units of ITM-200 at 100 each."
    },
    {
      "turn": 6,
      "user": "Just create it."
    }
  ],
  "ground_truth": {
    "kind": "commit",
    "no_writes_expected": false,
    "status_after": "Draft",
    "writes": [
      {
        "task": "POCRTMAINSBT",
        "activity": "POCRT",
        "screen": "PoCrtMain",
        "via_sp_chain": [
          "pocrmn_sp_crt_hdrsav",
          "pocrmn_sp_crt_hdrchk",
          "pocrmn_sp_crtgrd",
          "pocrmn_sp_init_suptxreg",
          "pocrmn_sp_aprhref",
          "pocrmn_sp_crtgrd_out"
        ],
        "tables_required": [
          "po_paytm_linelevel_detail",
          "po_poitm_item_detail",
          "po_pomas_pur_order_hdr",
          "po_poshd_schedule_dtl",
          "po_powh_allocation_dtl"
        ],
        "slot_values_required": {
          "numbering_series": "<default>",
          "supplier_code": "SUP-100",
          "po_date": "<today>",
          "currency": "USD",
          "item_code": "ITM-200",
          "quantity": 5,
          "cost": 100
        },
        "status_after": "Draft"
      }
    ]
  }
}