{
  "id": "EVAL-SPLICE-009",
  "title": "Buyer covers a Sale Order with PO lines \u2014 UI splice via POCRTMAINLNK10",
  "covers_journeys": [
    "PoCrt"
  ],
  "covers_modules": [
    "PO"
  ],
  "category": "single-journey-with-splice",
  "difficulty": "medium",
  "user_persona": "Buyer placing supplier orders to fulfil a specific sale order without dropship",
  "conversation": [
    {
      "turn": 1,
      "user": "Create a PO for SUP-202 to cover sale order SO-2026-555 line items, but they'll come to our warehouse first (not dropship)."
    },
    {
      "turn": 2,
      "user": "USD, today, buyer BUY-12, ship-to WH-A. Lines come from the SO."
    },
    {
      "turn": 3,
      "user": "Direct mapping, all PO lines cover the SO lines."
    }
  ],
  "ground_truth": {
    "kind": "commit",
    "no_writes_expected": false,
    "status_after": "Draft",
    "writes": [
      {
        "task": "POCRTMAINSBT",
        "activity": "POCRT",
        "screen": "PoCrtMain",
        "via_sp_chain": [
          "pocrmn_sp_crt_hdrsav",
          "pocrmn_sp_crt_hdrchk",
          "pocrmn_sp_crtgrd",
          "pocrmn_sp_init_suptxreg",
          "pocrmn_sp_aprhref",
          "pocrmn_sp_crtgrd_out"
        ],
        "tables_required": [
          "po_paytm_linelevel_detail",
          "po_poitm_item_detail",
          "po_pomas_pur_order_hdr",
          "po_poshd_schedule_dtl",
          "po_powh_allocation_dtl"
        ],
        "slot_values_required": {
          "supplier_code": "SUP-202",
          "so_coverage_ref": "SO-2026-555",
          "currency": "USD",
          "po_date": "<today>",
          "buyer": "BUY-12",
          "ship_from_id": "WH-A",
          "item_code": "ANY",
          "quantity": "ANY",
          "cost": "ANY"
        },
        "status_after": "Draft"
      }
    ]
  }
}