{
  "id": "EVAL-XJ-001",
  "title": "Buyer creates a PO and then approves it as a separate journey",
  "covers_journeys": [
    "PoCrt",
    "PoApp"
  ],
  "covers_modules": [
    "PO"
  ],
  "category": "cross-journey",
  "difficulty": "medium",
  "user_persona": "Buyer who has both create and approve rights and uses two separate flows",
  "conversation": [
    {
      "turn": 1,
      "user": "Quick PO for SUP-100, USD, today, BUY-1, ITM-50 10 at 30. Just save it."
    },
    {
      "turn": 2,
      "user": "Now approve the one I just created."
    },
    {
      "turn": 3,
      "user": "Yes approve."
    }
  ],
  "ground_truth": {
    "kind": "multi_commit",
    "no_writes_expected": false,
    "status_after": "Authorised",
    "writes": [
      {
        "task": "POCRTMAINSBT",
        "activity": "POCRT",
        "screen": "PoCrtMain",
        "via_sp_chain": [
          "pocrmn_sp_crt_hdrsav",
          "pocrmn_sp_crt_hdrchk",
          "pocrmn_sp_crtgrd",
          "pocrmn_sp_init_suptxreg",
          "pocrmn_sp_aprhref",
          "pocrmn_sp_crtgrd_out"
        ],
        "tables_required": [
          "po_paytm_linelevel_detail",
          "po_poitm_item_detail",
          "po_pomas_pur_order_hdr",
          "po_poshd_schedule_dtl",
          "po_powh_allocation_dtl"
        ],
        "slot_values_required": {
          "supplier_code": "ANY",
          "currency": "ANY",
          "po_date": "ANY",
          "buyer": "ANY",
          "item_code": "ANY",
          "quantity": "ANY",
          "cost": "ANY"
        },
        "status_after": "Authorised"
      },
      {
        "task": "POAPPMAINSBT",
        "activity": "POAPP",
        "screen": "PoAppMain",
        "via_sp_chain": [
          "poaprmn_sp_aprgrd",
          "poaprmn_sp_apr_hdrchk",
          "poaprmn_sp_aprhref",
          "poaprmn_sp_apr_hdrsav",
          "poaprmn_sp_aprgrd_out"
        ],
        "tables_required": [
          "lc_ord_map",
          "not_notes_dtl",
          "po_paytm_linelevel_detail",
          "po_poitm_item_detail",
          "po_pomas_pur_order_hdr",
          "po_poprq_poprcovg_detail",
          "po_poqly_quality_detail",
          "po_poshd_schedule_dtl",
          "po_poso_posocovg_detail",
          "po_potcd_doclevel_detail",
          "po_potcd_itemtcd_dtl",
          "po_potcd_otherlinetcd_dtl",
          "po_powh_allocation_dtl",
          "supp_item_itemmap"
        ],
        "slot_values_required": {
          "supplier_code": "ANY",
          "currency": "ANY",
          "po_date": "ANY",
          "buyer": "ANY",
          "item_code": "ANY",
          "quantity": "ANY",
          "cost": "ANY"
        },
        "status_after": "Authorised"
      }
    ]
  }
}