{
  "id": "EVAL-HAPPY-003",
  "title": "Buyer creates a dropship PO from a sale order",
  "covers_journeys": [
    "PoCrtSo"
  ],
  "covers_modules": [
    "PO"
  ],
  "category": "single-journey-happy-path",
  "difficulty": "medium",
  "user_persona": "Order management buyer handling a dropship sale",
  "conversation": [
    {
      "turn": 1,
      "user": "Customer placed sale order SO-2026-441 and we need to dropship from supplier SUP-DROP-3. Create the PO."
    },
    {
      "turn": 2,
      "user": "Yes, found it. Use everything from the SO and just confirm."
    },
    {
      "turn": 3,
      "user": "All confirmed. Create and approve in one go."
    }
  ],
  "ground_truth": {
    "kind": "commit",
    "no_writes_expected": false,
    "status_after": "Draft",
    "writes": [
      {
        "task": "POCRTSOSUB",
        "activity": "POCRTSO",
        "screen": "PoCrtSoEnt",
        "via_sp_chain": [
          "pocrtso_sp_sopohref",
          "pocrtso_sp_sopo_hdrsav",
          "pocrtso_sp_sopogrd",
          "pocrtso_sp_sopo_hdrchk",
          "pocrtso_sp_sopogrd_out"
        ],
        "tables_required": [
          "not_notes_attachdoc",
          "not_notes_dtl",
          "not_notes_hdr",
          "po_podoc_otherdoctcd_dtl",
          "po_poitm_item_detail",
          "po_poqly_quality_detail",
          "po_poshd_schedule_dtl",
          "po_poso_posocovg_detail",
          "po_potcd_doclevel_detail",
          "po_potcd_itemtcd_dtl",
          "po_powh_allocation_dtl"
        ],
        "slot_values_required": {
          "sale_order_no": "SO-2026-441",
          "supplier_code": "SUP-DROP-3",
          "customer_code": "ANY",
          "dropship_id": "ANY"
        },
        "status_after": "Draft"
      }
    ]
  }
}